{
  "workspaceRef": "fixture-workspace",
  "baseSnapshotHash": "9220e38f08d4e4102e5f174940b4f6b234e27bcff47fc00257599779ef85ce03",
  "targetPath": "target.txt",
  "desiredContentArtifactRef": {
    "artifactId": "0198e0a1-0000-7102-8002-000000000102",
    "sha256": "e666c1bc66aeb99394add94c88cd6ea7559e4f44deee1b6392ae7fad573b9ddb",
    "mediaType": "text/plain",
    "sizeBytes": 17,
    "sensitivity": "INTERNAL",
    "logicalName": "desired-content.txt"
  }
}
